[
  {
    "lastname": "Adler",
    "firstname": "Ada",
    "affiliation": "Institute for Legal History",
    "url": "https://example.edu/people/adler",
    "email": "ada.adler@example.edu",
    "portrait_url": "https://i.pravatar.cc/300?img=47"
  },
  {
    "lastname": "Bergman",
    "firstname": "Bo",
    "affiliation": "Centre for Socio-Legal Studies",
    "url": "https://example.ac.uk/people/bergman",
    "email": "bo.bergman@example.ac.uk"
  },
  {
    "lastname": "Okoro",
    "firstname": "Chidi",
    "affiliation": "Faculty of Law, University of Lagos",
    "url": "https://example.edu.ng/people/okoro",
    "email": "chidi.okoro@example.edu.ng",
    "portrait_url": "https://i.pravatar.cc/300?img=12"
  },
  {
    "lastname": "Kovac",
    "firstname": "Dana",
    "affiliation": "Department of Sociology, University of Zagreb",
    "url": "https://example.hr/people/kovac",
    "email": "dana.kovac@example.hr",
    "portrait_url": "https://i.pravatar.cc/300?img=32"
  },
  {
    "lastname": "Sundstrom",
    "firstname": "Erik",
    "affiliation": "Faculty of Law, Uppsala University",
    "email": "erik.sundstrom@example.se"
  }
]
